Table Index,Row Index,Original English,Thai Translation,Status
1,1,Course Introduction,บทนำหลักสูตร,Translated
1,2,Course Welcome,ยินดีต้อนรับหลักสูตร,Translated
1,3,SMENFP1.2_1_260427,SMENFP1.2_1_260427,Skipped/Protected
1,4,Course Welcome,ยินดีต้อนรับหลักสูตร,Translated
1,5,Course 01,หลักสูตร 01,Translated
1,6,Course 01,หลักสูตร 01,Translated
1,7,Foundations of ,รากฐานของ,Translated
1,8,Foundations of ,รากฐานของ,Translated
1,9,PLASTIC WASTE MANAGEMENT,การจัดการขยะพลาสติก,Translated
1,10,PLASTIC WASTE MANAGEMENT,การจัดการขยะพลาสติก,Translated
1,11,Welcome to the Foundations of Plastic Waste Management course.  Select Next to continue.,ยินดีต้อนรับสู่หลักสูตรพื้นฐานการจัดการขยะพลาสติก  เลือก ถัดไป เพื่อดำเนินการต่อ,Translated
1,12,Introduction​,บทนำ,Translated
1,13,Introduction,การแนะนำ,Translated
1,14,Plastic comes from a remarkable combination of properties.,พลาสติกมาจากการผสมผสานคุณสมบัติที่น่าทึ่ง,Translated
1,15,While the,ในขณะที่,Translated
1,16, , ,Skipped/Protected
1,17,benefits,ประโยชน์,Translated
1,18, , ,Skipped/Protected
1,19,of,ของ,Translated
1,20, , ,Skipped/Protected
1,21,plastics,พลาสติก,Translated
1,22, , ,Skipped/Protected
1,23,"are many, so too are the ",มีมากมายเช่นกัน,Translated
1,24,problems,ปัญหา,Translated
1,25, they ,พวกเขา,Translated
1,26,cause after use,สาเหตุหลังการใช้งาน,Translated
1,27,.,.,Skipped/Protected
1,28,Low cost,ต้นทุนต่ำ,Translated
1,29,"Resistant to  heat, chemicals, and light",ทนทานต่อความร้อน สารเคมี และแสง,Translated
1,30,Popularity  of Plastics,ความนิยมของพลาสติก,Translated
1,31,Basics of Plastic,พื้นฐานของพลาสติก,Translated
1,32,Impact of Plastic Waste,ผลกระทบของขยะพลาสติก,Translated
1,33,Easily molded or melted into different shapes,ขึ้นรูปหรือหลอมเป็นรูปทรงต่างๆ ได้อย่างง่ายดาย,Translated
1,34,Strength and durability,ความแข็งแรงและความทนทาน,Translated
1,35,Types of Plastic,ประเภทของพลาสติก,Translated
1,36,Benefits of Plastic,ประโยชน์ของพลาสติก,Translated
1,37,Application  of Plastic,การใช้พลาสติก,Translated
1,38,Plastics were invented more than ,พลาสติกถูกคิดค้นขึ้นมากกว่า,Translated
1,39,100 years ,100 ปี,Translated
1,40,ago.,ที่ผ่านมา.,Translated
1,41,Did you know that plastics were invented more than 100 years ago?  ,คุณรู้ไหมว่าพลาสติกถูกประดิษฐ์ขึ้นเมื่อกว่า 100 ปีที่แล้ว?,Translated
1,42, , ,Skipped/Protected
1,43,"Today, almost all the products we use in our daily lives contain plastics.  ",ปัจจุบันผลิตภัณฑ์เกือบทั้งหมดที่เราใช้ในชีวิตประจำวันมีพลาสติก,Translated
1,44, , ,Skipped/Protected
1,45,Their popularity comes from a remarkable combination of properties.  ,ความนิยมของพวกเขามาจากการผสมผสานคุณสมบัติที่โดดเด่น,Translated
1,46, , ,Skipped/Protected
1,47,"Plastics are resistant to heat, chemicals, and light. They are strong and durable and yet can be easily molded or melted into different shapes. Along with their low cost, these qualities have fueled the worldwide demand for plastics.  ",พลาสติกทนทานต่อความร้อน สารเคมี และแสง มีความแข็งแรงและทนทานแต่ยังสามารถขึ้นรูปหรือหลอมเป็นรูปทรงต่างๆ ได้อย่างง่ายดาย นอกจากต้นทุนที่ต่ำแล้ว คุณสมบัติเหล่านี้ยังกระตุ้นความต้องการพลาสติกทั่วโลกอีกด้วย,Translated
1,48, , ,Skipped/Protected
1,49,"However, there is a downside. Once plastics are discarded, they create significant environmental problems. Plastic waste accumulates rapidly, harming ecosystems and threatening our future.  ",อย่างไรก็ตาม มีข้อเสียอยู่ เมื่อทิ้งพลาสติกแล้ว จะก่อให้เกิดปัญหาสิ่งแวดล้อมที่สำคัญ ขยะพลาสติกสะสมอย่างรวดเร็ว เป็นอันตรายต่อระบบนิเวศ และคุกคามอนาคตของเรา,Translated
1,50, , ,Skipped/Protected
1,51,"To better understand both the promise and the problem of plastics, let’s explore their basics, types, benefits, and the growing challenges their waste presents.",เพื่อทำความเข้าใจทั้งคำมั่นสัญญาและปัญหาของพลาสติกให้ดีขึ้น เรามาสำรวจพื้นฐาน ประเภท ประโยชน์ และความท้าทายที่เพิ่มขึ้นของขยะพลาสติกกัน,Translated
1,52,Learning Objectives,วัตถุประสงค์การเรียนรู้,Translated
1,53,Learning Objectives,วัตถุประสงค์การเรียนรู้,Translated
1,54,"By the end of the course, you will be able to: ",เมื่อจบหลักสูตร คุณจะสามารถ:,Translated
1,55, , ,Skipped/Protected
1,56,Identify different types of plastic. ,จำแนกพลาสติกประเภทต่างๆ,Translated
1,57, , ,Skipped/Protected
1,58,List common applications of plastics. ,แสดงรายการการใช้งานทั่วไปของพลาสติก,Translated
1,59, , ,Skipped/Protected
1,60,Recognize the benefits plastics provide. ,ตระหนักถึงคุณประโยชน์ที่พลาสติกมอบให้,Translated
1,61, , ,Skipped/Protected
1,62,"Describe the impacts of plastic waste, including key issues and their effects.",อธิบายผลกระทบของขยะพลาสติก รวมถึงประเด็นสำคัญและผลกระทบ,Translated
1,63,"By the end of the course, you will be able to: ",เมื่อจบหลักสูตร คุณจะสามารถ:,Translated
1,64,"Identify different types of plastic, ",จำแนกพลาสติกประเภทต่างๆ,Translated
1,65,"List common applications of plastics, ",แสดงรายการการใช้งานทั่วไปของพลาสติก,Translated
1,66,"Recognize the benefits plastics provide, and ",ตระหนักถึงคุณประโยชน์ที่พลาสติกมอบให้ และ,Translated
1,67,"Describe the impacts of plastic waste, including key issues and their effects.",อธิบายผลกระทบของขยะพลาสติก รวมถึงประเด็นสำคัญและผลกระทบ,Translated
1,68,Menu,เมนู,Translated
1,69,FOUNDATIONS OF   ,รากฐานของ,Translated
1,70,PLASTIC WASTE MANAGEMENT,การจัดการขยะพลาสติก,Translated
1,71,30 mins,30 นาที,Translated
1,72,"Plastics and Plastic Waste: Types, Impact, and Future",พลาสติกและขยะพลาสติก: ประเภท ผลกระทบ และอนาคต,Translated
1,73,30 mins,30 นาที,Translated
1,74,"Plastics and Plastic Waste: Types, Impact, and Future",พลาสติกและขยะพลาสติก: ประเภท ผลกระทบ และอนาคต,Translated
1,75,30 mins,30 นาที,Translated
1,76,"Plastics and Plastic Waste: Types, Impact, and Future",พลาสติกและขยะพลาสติก: ประเภท ผลกระทบ และอนาคต,Translated
1,77,15 mins,15 นาที,Translated
1,78,Climate Interactions vs Plastic Waste Management,ปฏิสัมพันธ์ระหว่างสภาพภูมิอากาศกับการจัดการขยะพลาสติก,Translated
1,79,15 mins,15 นาที,Translated
1,80,Climate Interactions vs Plastic Waste Management,ปฏิสัมพันธ์ระหว่างสภาพภูมิอากาศกับการจัดการขยะพลาสติก,Translated
1,81,15 mins,15 นาที,Translated
1,82,Climate Interactions vs Plastic Waste Management,ปฏิสัมพันธ์ระหว่างสภาพภูมิอากาศกับการจัดการขยะพลาสติก,Translated
1,83,15 mins,15 นาที,Translated
1,84,Climate Interactions vs Plastic Waste Management,ปฏิสัมพันธ์ระหว่างสภาพภูมิอากาศกับการจัดการขยะพลาสติก,Translated
1,85,10 mins,10 นาที,Translated
1,86,Plastics in Solid Waste  Management: ,พลาสติกในการจัดการขยะมูลฝอย:,Translated
1,87,Flooding and Microbeads,น้ำท่วมและไมโครบีดส์,Translated
1,88,10 mins,10 นาที,Translated
1,89,Plastics in Solid Waste  Management: ,พลาสติกในการจัดการขยะมูลฝอย:,Translated
1,90,Flooding and Microbeads,น้ำท่วมและไมโครบีดส์,Translated
1,91,10 mins,10 นาที,Translated
1,92,Plastics in Solid Waste  Management: ,พลาสติกในการจัดการขยะมูลฝอย:,Translated
1,93,Flooding and Microbeads,น้ำท่วมและไมโครบีดส์,Translated
1,94,05 mins,05 นาที,Translated
1,95,Summary,สรุป,Translated
1,96,05 mins,05 นาที,Translated
1,97,Summary,สรุป,Translated
1,98,05 mins,05 นาที,Translated
1,99,Summary,สรุป,Translated
1,100,Select the highlighted module to proceed.,เลือกโมดูลที่ไฮไลต์เพื่อดำเนินการต่อ,Translated
1,101,The course is divided into four module. ,หลักสูตรนี้แบ่งออกเป็นสี่โมดูล,Translated
1,102, , ,Skipped/Protected
1,103,Select the highlighted module to proceed.,เลือกโมดูลที่ไฮไลต์เพื่อดำเนินการต่อ,Translated
1,104,Menu,เมนู,Translated
1,105,Circular Economy in Plastic Waste Management,เศรษฐกิจหมุนเวียนในการจัดการขยะพลาสติก,Translated
1,106,FOUNDATIONS OF   ,รากฐานของ,Translated
1,107,PLASTIC WASTE MANAGEMENT,การจัดการขยะพลาสติก,Translated
1,108,30 mins,30 นาที,Translated
1,109,"Plastics and Plastic Waste: Types, Impact, and Future",พลาสติกและขยะพลาสติก: ประเภท ผลกระทบ และอนาคต,Translated
1,110,30 mins,30 นาที,Translated
1,111,"Plastics and Plastic Waste: Types, Impact, and Future",พลาสติกและขยะพลาสติก: ประเภท ผลกระทบ และอนาคต,Translated
1,112,30 mins,30 นาที,Translated
1,113,"Plastics and Plastic Waste: Types, Impact, and Future",พลาสติกและขยะพลาสติก: ประเภท ผลกระทบ และอนาคต,Translated
1,114,15 mins,15 นาที,Translated
1,115,Climate Interactions vs Plastic Waste Management,ปฏิสัมพันธ์ระหว่างสภาพภูมิอากาศกับการจัดการขยะพลาสติก,Translated
1,116,15 mins,15 นาที,Translated
1,117,Climate Interactions vs Plastic Waste Management,ปฏิสัมพันธ์ระหว่างสภาพภูมิอากาศกับการจัดการขยะพลาสติก,Translated
1,118,15 mins,15 นาที,Translated
1,119,Climate Interactions vs Plastic Waste Management,ปฏิสัมพันธ์ระหว่างสภาพภูมิอากาศกับการจัดการขยะพลาสติก,Translated
1,120,10 mins,10 นาที,Translated
1,121,Plastics in Solid Waste  Management: ,พลาสติกในการจัดการขยะมูลฝอย:,Translated
1,122,Flooding and Microbeads,น้ำท่วมและไมโครบีดส์,Translated
1,123,10 mins,10 นาที,Translated
1,124,Plastics in Solid Waste  Management: ,พลาสติกในการจัดการขยะมูลฝอย:,Translated
1,125,Flooding and Microbeads,น้ำท่วมและไมโครบีดส์,Translated
1,126,10 mins,10 นาที,Translated
1,127,Plastics in Solid Waste  Management: ,พลาสติกในการจัดการขยะมูลฝอย:,Translated
1,128,Flooding and Microbeads,น้ำท่วมและไมโครบีดส์,Translated
1,129,05 mins,05 นาที,Translated
1,130,Summary,สรุป,Translated
1,131,05 mins,05 นาที,Translated
1,132,Summary,สรุป,Translated
1,133,05 mins,05 นาที,Translated
1,134,Summary,สรุป,Translated
1,135,Select the highlighted module to proceed.,เลือกโมดูลที่ไฮไลต์เพื่อดำเนินการต่อ,Translated
1,136,Select NEXT to continue.,เลือก NEXT เพื่อดำเนินการต่อ,Translated
1,137,4/62,4/62,Skipped/Protected
1,138,The course is divided into four module. ,หลักสูตรนี้แบ่งออกเป็นสี่โมดูล,Translated
1,139, , ,Skipped/Protected
1,140,Select the highlighted module to proceed.,เลือกโมดูลที่ไฮไลต์เพื่อดำเนินการต่อ,Translated
1,141,"Plastics and Plastic Waste: Types, Impact, and Future",พลาสติกและขยะพลาสติก: ประเภท ผลกระทบ และอนาคต,Translated
1,142,Camping Time!,เวลาแคมป์ปิ้ง!,Translated
1,143,Camping Time!,เวลาแคมป์ปิ้ง!,Translated
1,144,Anya  Malee’s daughter,ลูกสาวอัญญา มาลี,Translated
1,145,Professor Malee,อาจารย์มาลี,Translated
1,146,Nisha ,นิชา,Translated
1,147,Anya’s friend,เพื่อนของอันย่า,Translated
1,148,Daniel ,แดเนียล,Translated
1,149,Anya’s friend,เพื่อนของอันย่า,Translated
1,150,"Professor Malee loves to go camping. This time, he is accompanied by his daughter Anya and her friends Nisha and Daniel. ",อาจารย์มาลีชอบไปตั้งแคมป์ คราวนี้เขามาพร้อมกับอันย่าลูกสาวของเขาและเพื่อนของเธอนิชาและแดเนียล,Translated
1,151, , ,Skipped/Protected
1,152,Anya and Daniel go to the nearby stream to fill water. Daniel uses a plastic bottle and notices that Anya uses a metal one. ,อันยาและแดเนียลไปที่ลำธารใกล้ ๆ เพื่อเติมน้ำ แดเนียลใช้ขวดพลาสติกและสังเกตเห็นว่าย่าใช้ขวดที่เป็นโลหะ,Translated
1,153,Isn’t Plastic Convenient?,พลาสติกไม่สะดวกเหรอ?,Translated
1,154,But banana peels and plastic behave very differently in the environment.,แต่เปลือกกล้วยและพลาสติกมีพฤติกรรมแตกต่างกันมากในสิ่งแวดล้อม,Translated
1,155,Isn’t Plastic Convenient?,พลาสติกไม่สะดวกเหรอ?,Translated
1,156,"You can’t do that, Daniel! Throwing it away here will pollute the place. ",คุณไม่สามารถทำอย่างนั้นแดเนียล! การทิ้งที่นี่จะทำให้สถานที่เกิดมลพิษ,Translated
1,157,"Yes, it is. I shouldn't leave waste behind either.",ใช่มันเป็น ฉันก็ไม่ควรทิ้งขยะไว้ข้างหลังเช่นกัน,Translated
1,158,Not really. I just try to reduce plastic use  where I can. ,ไม่เชิง. ฉันแค่พยายามลดการใช้พลาสติกเท่าที่ทำได้,Translated
1,159,"But it’s so convenient. Like this plastic bottle. Once the trip is over, I’ll just throw it away. I don’t need to carry it back.",แต่มันสะดวกมาก เช่นขวดพลาสติกนี้ จบทริปแล้วผมจะทิ้งมันไป ฉันไม่จำเป็นต้องแบกมันกลับ,Translated
1,160,But yesterday I saw you toss a banana peel. Isn’t that  waste too?,แต่เมื่อวานฉันเห็นเธอโยนเปลือกกล้วย นั่นก็ไม่เสียเปล่าเหมือนกันเหรอ?,Translated
1,161,"Anya, I’ve noticed you don’t use as much plastic as the rest of us. Don’t tell me you’re some kind of environmental crusader?",อันย่า ฉันสังเกตว่าคุณไม่ได้ใช้พลาสติกมากเท่ากับพวกเราที่เหลือ อย่าบอกนะว่าคุณเป็นพวกทำสงครามสิ่งแวดล้อม?,Translated
1,162,"Daniel: Anya, I’ve noticed you don’t use as much plastic as the rest of us. Don’t tell me you’re some kind of environmental crusader? ",แดเนียล: อันย่า ฉันสังเกตเห็นว่าคุณไม่ได้ใช้พลาสติกมากเท่ากับพวกเราที่เหลือ อย่าบอกนะว่าคุณเป็นพวกทำสงครามสิ่งแวดล้อม?,Translated
1,163, , ,Skipped/Protected
1,164,Anya: Not really. I just try to reduce plastic use where I can.  ,อันย่า: ไม่จริงหรอก ฉันแค่พยายามลดการใช้พลาสติกเท่าที่ทำได้,Translated
1,165, , ,Skipped/Protected
1,166,"Daniel: But it’s so convenient. Like this plastic bottle. Once the trip is over, I’ll just throw it away. I don’t need to carry it back. ",แดเนียล: แต่มันสะดวกมาก เช่นขวดพลาสติกนี้ จบทริปแล้วผมจะทิ้งมันไป ฉันไม่จำเป็นต้องแบกมันกลับ,Translated
1,167, , ,Skipped/Protected
1,168,"Anya: You can’t do that, Daniel! Throwing it away here will pollute the place. ",อันย่า: คุณทำอย่างนั้นไม่ได้นะแดเนียล! การทิ้งที่นี่จะทำให้สถานที่เกิดมลพิษ,Translated
1,169, , ,Skipped/Protected
1,170,Daniel: But yesterday I saw you toss a banana peel. Isn’t that waste too? ,แดเนียล: แต่เมื่อวานฉันเห็นคุณโยนเปลือกกล้วย นั่นก็ไม่เสียเปล่าเหมือนกันเหรอ?,Translated
1,171, , ,Skipped/Protected
1,172,"Anya: Yes, it is. I shouldn't leave waste behind either. But banana peels and plastic behave very differently in the environment. ",อันย่า : ใช่แล้ว ฉันก็ไม่ควรทิ้งขยะไว้ข้างหลังเช่นกัน แต่เปลือกกล้วยและพลาสติกมีพฤติกรรมแตกต่างกันมากในสิ่งแวดล้อม,Translated
1,173, , ,Skipped/Protected
1,174,Plastic vs Banana,พลาสติกกับกล้วย,Translated
1,175,Plastic vs Banana,พลาสติกกับกล้วย,Translated
1,176,Natural organic ,อินทรีย์ธรรมชาติ,Translated
1,177,Synthetic organics  ,สารอินทรีย์สังเคราะห์,Translated
1,178,(Most are made from petrochemicals),(ส่วนใหญ่ทำจากปิโตรเคมี),Translated
1,179,Molecular structure of  some plastics or polymers,โครงสร้างโมเลกุลของพลาสติกหรือโพลีเมอร์บางชนิด,Translated
1,180,Molecular structure of banana peel,โครงสร้างโมเลกุลของเปลือกกล้วย,Translated
1,181,Both banana peels and plastics are organic. They’re  carbon-based compounds.  ,ทั้งเปลือกกล้วยและพลาสติกล้วนเป็นออร์แกนิก เป็นสารประกอบที่มีคาร์บอนเป็นหลัก,Translated
1,182,But there’s a big difference.,แต่มีความแตกต่างใหญ่,Translated
1,183,Biodegradable ,ย่อยสลายได้,Translated
1,184,Non-biodegradable,ไม่สามารถย่อยสลายได้,Translated
1,185,Stays in the environment for centuries,อยู่ในสิ่งแวดล้อมมานานหลายศตวรรษ,Translated
1,186,Disappears in weeks,หายไปในสัปดาห์,Translated
1,187,"Professor Malee: Anya is right. I agree, both banana peels and plastics are carbon-based organic compounds. But there’s a big difference.  ",ศาสตราจารย์มาลี: อัญญาพูดถูก ฉันยอมรับว่าทั้งเปลือกกล้วยและพลาสติกเป็นสารประกอบอินทรีย์ที่มีคาร์บอน แต่มีความแตกต่างใหญ่,Translated
1,188, , ,Skipped/Protected
1,189,"A banana peel is natural organic matter, so microorganisms can break it down. Plastics, on the other hand, are synthetic organics. Most are made from petrochemicals.  ",เปลือกกล้วยเป็นอินทรียวัตถุตามธรรมชาติ ดังนั้นจุลินทรีย์จึงสามารถย่อยสลายได้ ในทางกลับกัน พลาสติกเป็นสารอินทรีย์สังเคราะห์ ส่วนใหญ่ทำจากปิโตรเคมี,Translated
1,190, , ,Skipped/Protected
1,191,"These are refined, then turned into polymers, which are long, strong chains of molecules. When we modify these chains to make them tougher or waterproof, like in bottles, they become non-biodegradable.  ",สิ่งเหล่านี้ถูกทำให้บริสุทธิ์แล้วกลายเป็นโพลีเมอร์ซึ่งเป็นสายโซ่โมเลกุลที่ยาวและแข็งแรง เมื่อเราปรับเปลี่ยนโซ่เหล่านี้ให้แข็งแรงขึ้นหรือกันน้ำได้ เหมือนในขวด โซ่เหล่านี้จะไม่สามารถย่อยสลายทางชีวภาพได้,Translated
1,192, , ,Skipped/Protected
