Table Index,Row Index,Original English,Thai Translation,Status
1,1831,"Anya: That’s a very common misconception. Wet wipes are actually engineered fabrics made from synthetic polymers like polyester, polypropylene, and polyethylene. Some may contain viscose pulp or cotton, but they still behave like plastics.  ",ย่า: นั่นเป็นความเข้าใจผิดที่พบบ่อยมาก ผ้าเช็ดทำความสะอาดแบบเปียกเป็นผ้าที่ได้รับการออกแบบทางวิศวกรรมจากโพลีเมอร์สังเคราะห์ เช่น โพลีเอสเตอร์ โพลีโพรพีลีน และโพลีเอทิลีน บางชนิดอาจมีเยื่อวิสโคสหรือสำลี แต่ก็ยังมีพฤติกรรมเหมือนพลาสติก,Translated
1,1832, , ,Skipped/Protected
1,1833,Nisha: Oh! I had no idea.  ,นิชา: โอ้! ฉันไม่มีความคิด,Translated
1,1834, , ,Skipped/Protected
1,1835,"Professor Malee: Most people don’t. Because wet wipes don’t disintegrate like toilet paper, they clog sewer lines. This can block drainage systems, cause wastewater to back up into homes, and even lead to urban flooding. When sewers overflow, polluted water ends up in rivers and seas.  ",ศาสตราจารย์มาลี: คนส่วนใหญ่ไม่ทำ เนื่องจากทิชชู่เปียกไม่สลายเหมือนกระดาษชำระ จึงทำให้ท่อน้ำอุดตันได้ สิ่งนี้สามารถปิดกั้นระบบระบายน้ำ ทำให้น้ำเสียไหลกลับเข้าไปในบ้านเรือน และอาจนำไปสู่น้ำท่วมในเมืองด้วย เมื่อท่อระบายน้ำล้น น้ำเสียจะจบลงในแม่น้ำและทะเล,Translated
1,1836, , ,Skipped/Protected
1,1837,"In fact, the Washington Suburban Sanitary Commission spent more than $1 million dollars in installing heavy-duty grinders to shred wipes, and millions on repairing the damaged equipment from wet wipes that bring the New York’s sewer system under siege.  ",ในความเป็นจริง คณะกรรมการสุขาภิบาลชานเมืองวอชิงตันใช้เงินมากกว่า 1 ล้านดอลลาร์ในการติดตั้งเครื่องบดสำหรับงานหนักเพื่อฉีกผ้าเช็ดทำความสะอาด และอีกล้านดอลลาร์ในการซ่อมแซมอุปกรณ์ที่เสียหายจากผ้าเช็ดทำความสะอาดเปียกที่ทำให้ระบบท่อระบายน้ำของนิวยอร์กถูกปิดล้อม,Translated
1,1838, , ,Skipped/Protected
1,1839,"In London, Thames Water, a utility company, reported that in 2013 alone, 15 tons of wipes, cooking oil, and other materials were removed from sewers. ",ในลอนดอน บริษัท Thames Water ซึ่งเป็นบริษัทสาธารณูปโภครายงานว่าในปี 2013 เพียงปีเดียว ผ้าเช็ดทำความสะอาด น้ำมันปรุงอาหาร และวัสดุอื่นๆ จำนวน 15 ตันถูกนำออกจากท่อระบายน้ำ,Translated
1,1840, , ,Skipped/Protected
1,1841,Marine conservationists have said the number of wet wipes found on UK beaches has risen by around 50% over the past year.  ,นักอนุรักษ์ทางทะเลกล่าวว่าจำนวนทิชชู่เปียกที่พบในชายหาดในสหราชอาณาจักรเพิ่มขึ้นประมาณ 50% ในปีที่ผ่านมา,Translated
1,1842,Microplastics: Review,ไมโครพลาสติก: บทวิจารณ์,Translated
1,1843,Microplastics: Review,ไมโครพลาสติก: บทวิจารณ์,Translated
1,1844,Primary microplastics,ไมโครพลาสติกปฐมภูมิ,Translated
1,1845,Secondary microplastics,ไมโครพลาสติกทุติยภูมิ,Translated
1,1846,Read each statement and decide whether it is true or false.,อ่านแต่ละข้อความและตัดสินใจว่าเป็นจริงหรือเท็จ,Translated
1,1847,"I remember, you and your dad talked about primary and secondary microplastics during our camping trip.",ฉันจำได้ว่าคุณและพ่อคุยกันเรื่องไมโครพลาสติกปฐมภูมิและทุติยภูมิระหว่างการเดินทางแคมป์ปิ้งของเรา,Translated
1,1848,"For each statement, select the correct option and click SUBMIT once you’re done.",สำหรับแต่ละคำสั่ง ให้เลือกตัวเลือกที่ถูกต้องแล้วคลิกส่งเมื่อดำเนินการเสร็จแล้ว,Translated
1,1849,Statement,คำแถลง,Translated
1,1850,True,จริง,Translated
1,1851,False,เท็จ,Translated
1,1852,Microplastics are only formed through the breakdown of larger plastic items.,ไมโครพลาสติกเกิดขึ้นจากการสลายชิ้นส่วนพลาสติกขนาดใหญ่เท่านั้น,Translated
1,1853,Primary microplastics are plastics directly released into the environment in the form of small particulates.,ไมโครพลาสติกปฐมภูมิคือพลาสติกที่ถูกปล่อยออกสู่สิ่งแวดล้อมโดยตรงในรูปของอนุภาคขนาดเล็ก,Translated
1,1854,Secondary microplastics are manufactured as microscopic particles and are sometimes accidentally released during industrial processes.,ไมโครพลาสติกทุติยภูมิผลิตขึ้นในลักษณะอนุภาคขนาดเล็กมาก และบางครั้งอาจปล่อยออกมาโดยไม่ได้ตั้งใจในระหว่างกระบวนการทางอุตสาหกรรม,Translated
1,1855,Microplastic particles are frequently ingested by humans and can damage organs and leach hazardous chemicals.,อนุภาคไมโครพลาสติกมักถูกมนุษย์กลืนเข้าไป และอาจสร้างความเสียหายต่ออวัยวะต่างๆ และปล่อยสารเคมีอันตรายออกมาได้,Translated
1,1856,"Both microplastics and associated chemicals accumulate along the food chain, impacting the entire ecosystem.",ทั้งไมโครพลาสติกและสารเคมีที่เกี่ยวข้องสะสมตามห่วงโซ่อาหาร ส่งผลกระทบต่อระบบนิเวศทั้งหมด,Translated
1,1857,"Since wet wipes contain plastic, they eventually break down into microplastics as they decompose.",เนื่องจากทิชชู่เปียกมีส่วนประกอบของพลาสติก จึงสลายตัวเป็นไมโครพลาสติกในที่สุดเมื่อสลายตัว,Translated
1,1858,SUBMIT,ส่งข้อมูล,Translated
1,1859,SUBMIT,ส่งข้อมูล,Translated
1,1860,SUBMIT,ส่งข้อมูล,Translated
1,1861,"Anya: Since wet wipes contain plastic, they eventually break down into microplastics as they decompose.  ",อัญญา: เนื่องจากผ้าเช็ดทำความสะอาดแบบเปียกมีส่วนประกอบของพลาสติก จึงสลายตัวเป็นไมโครพลาสติกในที่สุดเมื่อสลายตัว,Translated
1,1862, , ,Skipped/Protected
1,1863,Daniel: I remember you and your dad talked about primary and secondary microplastics yesterday.  ,แดเนียล: ฉันจำได้ว่าคุณกับพ่อคุยกันเรื่องไมโครพลาสติกปฐมภูมิและทุติยภูมิเมื่อวานนี้,Translated
1,1864, , ,Skipped/Protected
1,1865,Narrator: Can you recall what you learned about microplastics?  ,ผู้บรรยาย: คุณจำสิ่งที่คุณเรียนรู้เกี่ยวกับไมโครพลาสติกได้ไหม,Translated
1,1866, , ,Skipped/Protected
1,1867,Read each statement and decide whether it is true or false.  ,อ่านแต่ละข้อความและตัดสินใจว่าเป็นจริงหรือเท็จ,Translated
1,1868, , ,Skipped/Protected
1,1869,"For each statement, select the correct option and click SUBMIT once you’re done. ",สำหรับแต่ละคำสั่ง ให้เลือกตัวเลือกที่ถูกต้องแล้วคลิกส่งเมื่อดำเนินการเสร็จแล้ว,Translated
1,1870,You got it right!,คุณเข้าใจถูกแล้ว!,Translated
1,1871,Contaminates the Food Chain,ปนเปื้อนห่วงโซ่อาหาร,Translated
1,1872, , ,Skipped/Protected
1,1873,"Marine animals ingest the microplastics, causing them to accumulate in the ecosystem.",สัตว์ทะเลกินไมโครพลาสติกเข้าไป ทำให้เกิดการสะสมในระบบนิเวศ,Translated
1,1874,Reaches Humans,เข้าถึงมนุษย์,Translated
1,1875, , ,Skipped/Protected
1,1876,"We consume them via seafood, risking organ damage and chemical exposure.",เราบริโภคพวกมันผ่านทางอาหารทะเล ซึ่งเสี่ยงต่อความเสียหายต่ออวัยวะและการสัมผัสสารเคมี,Translated
1,1877,Enters Waterways,เข้าสู่ทางน้ำ,Translated
1,1878, , ,Skipped/Protected
1,1879,"Washed into sewers, they  bypass filters and flow into  rivers and seas.",เมื่อถูกล้างลงในท่อระบายน้ำ พวกมันจะเลี่ยงตัวกรองและไหลลงสู่แม่น้ำและทะเล,Translated
1,1880,The Source,แหล่งที่มา,Translated
1,1881, , ,Skipped/Protected
1,1882,Particles are added to products (primary) or form from  degrading plastics (secondary).,อนุภาคถูกเติมลงในผลิตภัณฑ์ (หลัก) หรือรูปแบบจากการย่อยสลายพลาสติก (รอง),Translated
1,1883,CONTINUE,CONTINUE,Skipped/Protected
1,1884,CONTINUE,CONTINUE,Skipped/Protected
1,1885,Continue,CONTINUE,Translated
1,1886,"Good attempt, but you didn’t get all correct.",พยายามดี แต่คุณไม่ถูกต้องทั้งหมด,Translated
1,1887,Contaminates the Food Chain,ปนเปื้อนห่วงโซ่อาหาร,Translated
1,1888, , ,Skipped/Protected
1,1889,"Marine animals ingest the microplastics, causing them to accumulate in the ecosystem.",สัตว์ทะเลกินไมโครพลาสติกเข้าไป ทำให้เกิดการสะสมในระบบนิเวศ,Translated
1,1890,Reaches Humans,เข้าถึงมนุษย์,Translated
1,1891, , ,Skipped/Protected
1,1892,"We consume them via seafood, risking organ damage and chemical exposure.",เราบริโภคพวกมันผ่านทางอาหารทะเล ซึ่งเสี่ยงต่อความเสียหายต่ออวัยวะและการสัมผัสสารเคมี,Translated
1,1893,Enters Waterways,เข้าสู่ทางน้ำ,Translated
1,1894, , ,Skipped/Protected
1,1895,"Washed into sewers, they  bypass filters and flow into  rivers and seas.",เมื่อถูกล้างลงในท่อระบายน้ำ พวกมันจะเลี่ยงตัวกรองและไหลลงสู่แม่น้ำและทะเล,Translated
1,1896,The Source,แหล่งที่มา,Translated
1,1897, , ,Skipped/Protected
1,1898,Particles are added to products (primary) or form from  degrading plastics (secondary).,อนุภาคถูกเติมลงในผลิตภัณฑ์ (หลัก) หรือรูปแบบจากการย่อยสลายพลาสติก (รอง),Translated
1,1899,CONTINUE,CONTINUE,Skipped/Protected
1,1900,CONTINUE,CONTINUE,Skipped/Protected
1,1901,Continue,CONTINUE,Translated
1,1902,Microbeads in City’s Sewer System,ไมโครบีดส์ในระบบท่อน้ำทิ้งของเมือง,Translated
1,1903,Microbeads in City’s Sewer System ,ไมโครบีดส์ในระบบท่อน้ำทิ้งของเมือง,Translated
1,1904,Domestic Wastewater,น้ำเสียชุมชน,Translated
1,1905,Industrial Effluents,น้ำทิ้งอุตสาหกรรม,Translated
1,1906,Household Products,ผลิตภัณฑ์ในครัวเรือน,Translated
1,1907,"Unfortunately, wastewater treatment plants are not designed to filter out microplastics or microbeads.",น่าเสียดายที่โรงบำบัดน้ำเสียไม่ได้ออกแบบมาเพื่อกรองไมโครพลาสติกหรือไมโครบีดส์,Translated
1,1908,Their low density makes it challenging  to remove all microplastics.,ความหนาแน่นต่ำทำให้การกำจัดไมโครพลาสติกทั้งหมดเป็นเรื่องยาก,Translated
1,1909,Wastewater treatment plants are NOT designed to remove microplastics or microbeads.,โรงงานบำบัดน้ำเสียไม่ได้ออกแบบมาเพื่อกำจัดไมโครพลาสติกหรือไมโครบีดส์,Translated
1,1910,Why are microplastics so hard to remove in treatment plants?,เหตุใดไมโครพลาสติกจึงกำจัดออกได้ยากในโรงบำบัด,Translated
1,1911,Don’t wastewater treatment plants filter them out?,โรงงานบำบัดน้ำเสียไม่กรองมันออกเหรอ?,Translated
1,1912,How do such tiny plastic particles cause so much trouble?,อนุภาคพลาสติกเล็กๆ เช่นนี้สร้างปัญหามากมายได้อย่างไร?,Translated
1,1913,Microplastics,ไมโครพลาสติก,Translated
1,1914,Activated Sludge Flocs,ตะกอนตะกอนที่เปิดใช้งาน,Translated
1,1915,"(e.g. Polyetheine, Nylon) ",(เช่น โพลีเอเทอีน ไนลอน),Translated
1,1916,Captured,ถูกจับแล้ว,Translated
1,1917,99% ,99%,Translated
1,1918,of Plastic Particles,ของอนุภาคพลาสติก,Translated
1,1919,Sewage Sludge,กากตะกอนน้ำเสีย,Translated
1,1920,Treatment Process,กระบวนการบำบัด,Translated
1,1921,"Plastics Accumulate in Sludge, Not Removed!",พลาสติกสะสมอยู่ในตะกอน ไม่ถูกเอาออก!,Translated
1,1922,Untreated Microplastics,ไมโครพลาสติกที่ไม่ผ่านการบำบัด,Translated
1,1923,Pass Through Treatment,ผ่านการรักษา,Translated
1,1924,"Rivers, Lakes, and Ocean",แม่น้ำ ทะเลสาบ และมหาสมุทร,Translated
1,1925,Plastic Pollution in the Oceans,มลพิษพลาสติกในมหาสมุทร,Translated
1,1926,"Microplastics Flow to the Sea, Adding to the",ไมโครพลาสติกไหลลงสู่ทะเล เพิ่มลงใน,Translated
1,1927, , ,Skipped/Protected
1,1928,“Plastic Soup”,“ซุปพลาสติก”,Translated
1,1929,Nisha: I still don’t understand how such tiny plastic particles cause so much trouble. Don’t wastewater treatment plants filter them out? ,นิชา: ฉันยังไม่เข้าใจว่าอนุภาคพลาสติกเล็กๆ แบบนี้สร้างปัญหามากมายได้อย่างไร โรงงานบำบัดน้ำเสียไม่กรองมันออกเหรอ?,Translated
1,1930, , ,Skipped/Protected
1,1931,"Anya: Unfortunately, wastewater treatment plants are not designed to remove microplastics or microbeads. They receive cumulative plastic loads from domestic wastewater, industrial effluents, and everyday household products. While around 99% of plastic particles are transferred from the liquid fraction of wastewater into sewage sludge, they are not eliminated during treatment. Ultimately, these plastics contribute to the “plastic soup” circulating through the world’s oceans. ",อัญญา: น่าเสียดายที่โรงบำบัดน้ำเสียไม่ได้ออกแบบมาเพื่อกำจัดไมโครพลาสติกหรือไมโครบีดส์ พวกเขารับปริมาณพลาสติกสะสมจากน้ำเสียในครัวเรือน น้ำทิ้งจากโรงงานอุตสาหกรรม และผลิตภัณฑ์ในครัวเรือนในชีวิตประจำวัน แม้ว่าอนุภาคพลาสติกประมาณ 99% จะถูกถ่ายโอนจากส่วนที่เป็นของเหลวของน้ำเสียไปยังกากตะกอนน้ำเสีย แต่อนุภาคเหล่านั้นจะไม่ถูกกำจัดออกในระหว่างการบำบัด ในที่สุด พลาสติกเหล่านี้มีส่วนทำให้เกิด “ซุปพลาสติก” ที่หมุนเวียนไปตามมหาสมุทรทั่วโลก,Translated
1,1932, , ,Skipped/Protected
1,1933,Daniel: Why are microplastics so hard to remove in treatment plants?  ,แดเนียล: เหตุใดไมโครพลาสติกจึงกำจัดออกได้ยากในโรงบำบัด,Translated
1,1934, , ,Skipped/Protected
1,1935,"Professor Malee: Because of their low density, many plastic particles remain floating on the water surface as microplastics. Sedimentation tanks are not designed to remove lightweight materials such as polyethylene and nylon. If these particles are not captured within activated sludge flocs, they pass through the treatment process and ultimately end up in rivers, lakes, and oceans.",ศาสตราจารย์มาลี: เนื่องจากมีความหนาแน่นต่ำ อนุภาคพลาสติกจำนวนมากจึงยังคงลอยอยู่บนผิวน้ำเหมือนไมโครพลาสติก ถังตกตะกอนไม่ได้ออกแบบมาเพื่อกำจัดวัสดุน้ำหนักเบา เช่น โพลีเอทิลีนและไนลอน หากอนุภาคเหล่านี้ไม่ถูกดักจับภายในกลุ่มตะกอนเร่ง พวกมันจะผ่านกระบวนการบำบัดและสุดท้ายจะจบลงในแม่น้ำ ทะเลสาบ และมหาสมุทร,Translated
1,1936,Impact of Microplastics on Wastewater Treatment Plants,ผลกระทบของไมโครพลาสติกต่อโรงบำบัดน้ำเสีย,Translated
1,1937,Impact of Microplastics on Wastewater Treatment Plants ,ผลกระทบของไมโครพลาสติกต่อโรงบำบัดน้ำเสีย,Translated
1,1938,Impact on Wastewater  Treatment,ผลกระทบต่อการบำบัดน้ำเสีย,Translated
1,1939,Reduced Coagulation,การแข็งตัวลดลง,Translated
1,1940,Microbial Alteration,การเปลี่ยนแปลงของจุลินทรีย์,Translated
1,1941,"Precisely. When biosolids are applied in agriculture, they become a significant  source of plastic entering the soil and the wider environment.",แม่นยำ. เมื่อนำของแข็งชีวภาพไปใช้ในการเกษตร พวกมันจะกลายเป็นแหล่งสำคัญของพลาสติกที่เข้าสู่ดินและสิ่งแวดล้อมในวงกว้าง,Translated
1,1942,Membrane Fouling and Abrasion,การเปรอะเปื้อนของเมมเบรนและการเสียดสี,Translated
1,1943,Does that mean the problem just moves from water to land?,นั่นหมายความว่าปัญหาเพียงแค่ย้ายจากน้ำสู่พื้นดินใช่หรือไม่,Translated
1,1944,Air Bubble Disruption,การหยุดชะงักของฟองอากาศ,Translated
1,1945,Clogging and Filtratiency,การอุดตันและการกรอง,Translated
1,1946,Disinfection Resistance,ความต้านทานการฆ่าเชื้อ,Translated
1,1947,Select each impact to learn more.,เลือกผลกระทบแต่ละรายการเพื่อเรียนรู้เพิ่มเติม,Translated
1,1948,"Daniel: So, the problem just moves from water to land? ",แดเนียล: แล้วปัญหาก็แค่ย้ายจากน้ำหนึ่งไปอีกฝั่งหนึ่งเหรอ?,Translated
1,1949, , ,Skipped/Protected
